post_id,title,selftext,score,num_comments,upvote_ratio,subreddit,author,post_url,external_url,search_query,matched_news_title,matched_news_source,matched_news_url,created_utc
1np1rv1,"Donald Trump now claims to have learned that Ukraine with the help of Europe and particularly its NATO allies can not only retake all its territories but perhaps even more; Calling Russia a ""Paper Tiger."" Is the Alaskan Summit goals for peace between Ukraine and Russia now completely dead?","President Donald Trump said Tuesday, \[shortly after a meeting with Zelensky\] on social media post that he thinks Ukraine, with help from European allies, could win back all the land it’s lost to Russia, a country he called a “paper tiger.” 

During his meeting with the Ukrainian leader on the sidelines of the U.N. General Assembly, Trump also said he thinks NATO countries should shoot down Russian aircraft if they enter their airspace. “Yes, I do,” Trump said in response to a reporter when asked about that scenario. 

Is the Alaskan Summit goals for peace between Ukraine and Russia now completely dead? 

[https://www.bbc.com/news/articles/c07vm35rryeo](https://www.bbc.com/news/articles/c07vm35rryeo)

[U.N. highlights: Trump says Ukraine could win back all land that ‘paper tiger’ Russia took - The Washington Post](https://www.washingtonpost.com/politics/2025/09/23/trump-united-nations-address-live/)

",611,157,0.98,PoliticalDiscussion,PsychLegalMind,https://www.reddit.com/r/PoliticalDiscussion/comments/1np1rv1/donald_trump_now_claims_to_have_learned_that/,https://www.reddit.com/r/PoliticalDiscussion/comments/1np1rv1/donald_trump_now_claims_to_have_learned_that/,Iran Says It Will Halt Attacks On Neighbours; Trump Calls,Iran Says It Will Halt Attacks On Neighbours; Trump Calls Them The 'Loser of Middle East',ndtv,https://www.ndtvprofit.com/world/iran-says-it-will-halt-attacks-on-neighbours-trump-views-it-a-surrender-11182213,2025-09-24 03:25:35
1noj7xh,Is the Political Doom Clock Ticking?,"Right after Trumps inauguration, I posted here about my fears that we could soon be sliding into a fascist dictatorship given Trumps own words and threats. One response I received said i was overreacting given the political and social mechanisms in place to ensure the maintenance of democracy, i.e. Congress, the courts, the media and voters. 

Given where we are today, I want to ask that responder whether they still believe  the that Trumps words and bombastic manner did not mean he could implement his threats. 

Whete are we now? Congress and SCOTUS have rolled over to Trump and abdicated their constitutional duties. The broadcast media is muted because of their fear of Trumps FCC. Print media is under attack too through attempts to clamp down on freedom of the press amd freedom of speech. Proposed new voter ID laws  and expanded GOP gerrymandering will suppress the votes and voting power of those opposed to Trump. 

The traditional balance of power between the legs of the ""3 legged stool"" is gone. The country did not believe that Project 2025 was his actual playbook for becoming dictator of the American Reich just like Mein Kampf was for Hitler. 

In summary, we are now well past 11PM on the US political doom clock.",85,48,0.89,Liberal,Own_Entertainment847,https://www.reddit.com/r/Liberal/comments/1noj7xh/is_the_political_doom_clock_ticking/,https://www.reddit.com/r/Liberal/comments/1noj7xh/is_the_political_doom_clock_ticking/,Pezeshkian further said that neighbouring countries will not,Iran Says It Will Halt Attacks On Neighbours; Trump Calls Them The 'Loser of Middle East',ndtv,https://www.ndtvprofit.com/world/iran-says-it-will-halt-attacks-on-neighbours-trump-views-it-a-surrender-11182213,2025-09-23 14:41:02
1noizpp,"Why have we become an ""all or nothing"" society?   What happened to reasonable conversation and compromise - or even levels of what is ok vs. what is not?","I know so many are going to argue with my points, and I'll get downvoted to oblivian, but I don't care.  It seems you are required to ""drink the koolaid"" and agree with something wholeheartedly or be attacked by one side or the other - but on some levels, can't there be points that both sides make on an issue that are reasonable and good? 

Examples include - 

Vaccines against deadly disesases are good.  Small pox and polio have been eradicated.  Measles and mumps are dangerous.  Chicken pox - meh.  But MAYBE our vaccines schedules are a bit overwhelming for baby bodies.  MAYBE we shouldn't be giving 5 shots at one doctor visit especially since we can't test the effects on babies.  MAYBE, we should be looking at the preservatives in modern vaccines vs. the fresh ones they used to give that have to be refrigerated.  Shouldn't we have informed choices when we get vaccines?  What is in them, and how they are made?  And MAYBE, we should be looking at home much money big pharma makes off the drugs and vaccines they push.  We find insurance companies to be evil, but not big pharma?  Make that make sense.  But let's have the discussion.  Let's give parents a choice of a slower vaccine schedule and maybe more would be willing.  Shutting people's concerns down is not the way to convince people. 

Food.  C'mon, people - we know preservatives and fake sugar, and even too much real sugar, are bad.  Until it became political, we all agreed on that - so let's talk about having the FDA do their job and put reasonable limits on that.  And while we're at it - we make companies label so much, so why are so many against requiring food makers to tell us when they use genetically modified foods.  It's just information - why is that bad?

The three strike rule.  Some say it is too harsh that minor crimes can get you imprisoned for life.  So, how about the three strike rule for violent crimes?  3 shoplifting crimes - of course not, but 3 muggings or sexual assualts?  That person doesn't belong free in society.  And why the hell do we treat domestic violence more leniently that other kinds of violence?  

Today's Tylenol annoucement has people going nuts and vowing to take tons of Tylenol.  Be serious people - too much Tylenol is BAD.  We all know that.  It's not new.  There's a warning on every bottle.  Moderation is important.  But I have a feeling that it will be political now to say not to take too much Tylenol in the future.  Good grief. 

Autism.  I'm sorry, but the incidences of autism have skyrocketed.  Anyone who went to school 40 years ago vs. now knows this.  Stop trying to gaslight us by saying it hasn't.  We don't KNOW why, but the discussion needs to be had.  We need to figure it out.  We have so much more manufactured crap that we use now, and there has to be something - so let's talk about it and brainstorm and test our theories to kingdom come.  And I don't think it's Tylenol personally, but if we stop giving Tylenol to pregnant women, and the autism rates don't go down - well, that theory was wrong, let's move on to the next.  But, hey, maybe it proves to be true.  Or maybe it's all the new artifical sweenteners.  Or maybe it's too many ultrasounds.  Maybe it's a combination.  Who the hell knows - there's no autism ""gene"" but research shows mutated genes that can be a factor and can be inherited - what is causing that mutation?  Let's start a questionairre to pregnant women regarding their eating and lifestyle habits - track it and find correlations so we can test for causation.  I know that is not popular because we don't want moms to think they did something or made a choice that caused autism, but that's not on moms - that's on whoever won't actually let us ask the questions. 

I'm sure there are lots of others I'm not thinking of.  I just don't get the stubborn REFUSAL to have discussions, do research and have differing opinions.  And the research cannot be funded by interested parties - it must be neutral.",1957,347,0.88,Conservative,scrapqueen,https://www.reddit.com/r/Conservative/comments/1noizpp/why_have_we_become_an_all_or_nothing_society_what/,https://www.reddit.com/r/Conservative/comments/1noizpp/why_have_we_become_an_all_or_nothing_society_what/,Iran Says It Will Halt Attacks On Neighbours; Trump Calls,Iran Says It Will Halt Attacks On Neighbours; Trump Calls Them The 'Loser of Middle East',ndtv,https://www.ndtvprofit.com/world/iran-says-it-will-halt-attacks-on-neighbours-trump-views-it-a-surrender-11182213,2025-09-23 14:31:56
1nmai4f,The hypocrisy of the American democrat,"Tucker Carlson fired =  celebration 
Gina Carano fired = celebration
Charlie Kirk murdered = celebration
Jimmy Kimmel canceled = outrage and boycotts

We’re living in some very dangerous times with this line of thinking that many, if not the majority of the American left continue to believe. “Rules for thee but not for me” come to mind when thinking about what happened to Kimmel. To them, it’s ok to silence and de platform right-of-center influencers because they’re all racists and Nazis apparently. But when the same tactics are used on their own, especially to someone intentionally spreading false info, free speech is all of a sudden at risk. And before anyone even brings up the FCC (which is cute cause they were silent when the previous administration was pressuring social media platforms) ABC and Disney stated that their decision was 100% theirs alone and had nothing to do with any FCC pressure.

Until more democrats finally begin to admit that their side has a lot of problems that are contributing to the rising climate in our society, things will only get worse from here. 

Of course, this is reddit though. Everyone outside of this subreddit will never admit that the American left has a serious rhetoric and accountability problem. ",311,51,0.79,Conservative,ThatGuy7698,https://www.reddit.com/r/Conservative/comments/1nmai4f/the_hypocrisy_of_the_american_democrat/,https://www.reddit.com/r/Conservative/comments/1nmai4f/the_hypocrisy_of_the_american_democrat/,India's rise is 'unstoppable' and it alone will determine trajectory,India's rise is 'unstoppable' and it alone will determine trajectory of its growth: Jaishankar,deccanherald,https://www.deccanherald.com/india/indias-rise-is-unstoppable-and-it-alone-will-determine-trajectory-of-its-growth-jaishankar-3923235,2025-09-20 21:45:17
1nm7g0s,How to left wins sometimes - a reminder,"Dear conservatives,I want to share this message on how in certain moments left is able to get a win when conservatives are less careful and one of those is happening right now.

As you know a lot of immigrants turned up for Trump and R last election because they believed trump is the common sense candidate. Many still do. I am a conservative, an immigrant and I am one of them.

However with everything happening on immigration raids and now add to that H1B discussion, a lot of those immigrants are dealing with toxic racism and attacks on them that are coming from the right. 

Many immigrants like me support the policy but the racist attack by right against me and people like me are alienating and pushing me out from the social circles on the right. 

I can share examples if anyone is interested.

I hope no one suffers this but just so some of you can relate - it's absolutely humiliating when someone calls you names, demeans you, your race - specially the same people you thought were your brethren. It's beyond horrifying.

This is how left wins when you alienate good people for petulant childish name calling",111,81,0.66,Conservative,Miserable_Lemon8742,https://www.reddit.com/r/Conservative/comments/1nm7g0s/how_to_left_wins_sometimes_a_reminder/,https://www.reddit.com/r/Conservative/comments/1nm7g0s/how_to_left_wins_sometimes_a_reminder/,Iran Says It Will Halt Attacks On Neighbours; Trump Calls,Iran Says It Will Halt Attacks On Neighbours; Trump Calls Them The 'Loser of Middle East',ndtv,https://www.ndtvprofit.com/world/iran-says-it-will-halt-attacks-on-neighbours-trump-views-it-a-surrender-11182213,2025-09-20 19:37:50
1nm5axr,A Matter of Foreign Policy,"I'm not exactly a frequent poster, but seeing as this sub hasnt really been talking about much beyond the murder of Kirk in the past week or so, I feel that there has been some important and worrying events that I feel aren't getting enough attention. Please forgive this not being a very well put together post, I'm not exactly a writer.

Namely, amidst Trump's push to cut aid to our NATO allies on the eastern flank, Putin seems to have taken this as permission to do as he pleases and begin testing the waters, pushing and finding out that America's response has been anemic. [Drones over Poland](https://www.newsweek.com/russian-drones-attempt-enter-nato-airspace-again-poland-2131812). [Jets over the Baltics](https://www.reuters.com/business/aerospace-defense/nato-member-estonia-says-three-russian-jets-violated-its-airspace-2025-09-19/). Russia has been pushing and pushing ever since that Alaska meeting, and Trump's response has been to just keep holding off on sanctions in some naive hope that Putin will suddenly decide to actually engage in good faith peace talks after months of him giving nothing more than token efforts. And, (in all honesty I can't find the source for this, so I might be wrong,) in the midst of all this you have Trump making statements blaming Zelensky for doing his best to find more weapons for his people and blaming Ukraine for starting the war?

In my opinion, this administration's foreign policy has been a neurotic mess. One second Trump finally gets all NATO members to finally meet the 2% goal and agree to raise the goal, the next he's tariffing all our allies and making threats of annexation towards Canada and Greenland. One second he finally puts his foot down and sets a clear deadline before he begins crippling sanctions against Russia, the next that deadline expires and literally nothing happens. 

America is the greatest country to ever exist, but despite what some isolationists think, we can't go it alone. We have the greatest military ever seen, but all the aircraft carriers in the world won't maintain NATO if our allies and enemies alike see that poking the bear just results in it rolling over and falling back asleep. We need to take a strong, firm stance against Russia and for our allies, not be withdrawing from the fire just as it starts to get hot. I can appreciate what Trump has done for stopping the immigration crisis, restoring law and order, but I was always more focused on foreign than domestic policy this election, and almost everything I've seen from Trump in that department has made me feel vindicated in writing in Haley instead of him.

Sorry for the rambling, lol. This was just supposed to be bringing up the events in Poland and the Baltics, but it just kind of spiraled from there, haha.",53,15,0.8,Conservative,Krioniki,https://www.reddit.com/r/Conservative/comments/1nm5axr/a_matter_of_foreign_policy/,https://www.reddit.com/r/Conservative/comments/1nm5axr/a_matter_of_foreign_policy/,Iran Says It Will Halt Attacks On Neighbours; Trump Calls,Iran Says It Will Halt Attacks On Neighbours; Trump Calls Them The 'Loser of Middle East',ndtv,https://www.ndtvprofit.com/world/iran-says-it-will-halt-attacks-on-neighbours-trump-views-it-a-surrender-11182213,2025-09-20 18:12:18
1nlvhfk,A Better Way,"I keep seeing people talking about how they canceled their Disney + and while, sure, Disney will feel that in the short-term the idea that ending a subscription that, lets be honest, you'll be back on in a few months isn't the best way to go about this. Yes, you can downvote now because I called your tactic empty. Disney only pulled Kimmel from the air after Sinclair and Nexstar pulled him first. Even if ABC and Disney kept making his episodes you would still never see them because Sinclair and Nexstar have the rights to air what they want. They should be the target of your ire. 

So, see if you have a Sinclair or Nexstar station in your area. Watch the newscast and note the companies that bought TV adverts. Write and call them in mass to express how you dislike them supporting government censorship. Then you do the same to Sinclair or Nexstar. A book of stamps cost $25 dollars, since you're not paying Disney you'll have that now. Use them. If Sinclair and Nexstar get 10 million letters and if Pepsi, Ford, and Auto Zone get another 10 million someone might pay attention. Then stick to your little boycott. Just not watching Disney isn't enough, you have to go after the people that fund the local stations. So stop drinking, eating, or buying the products featured in their ads. (This is base on an Tweet by Dan Satterfield, a former meteorologists). 

I don't like how people are looking at this and understanding what it is, government censorship of a critic, then getting that this is a serious attack on our ability to stand against a man who doesn't want elections in 3 years, but they are only willing to go 1/10th of the way to doing something about it. If you believe that the FCC chair going on a rightwing podcast and threatening TV stations is wrong then go after the damn money otherwise... you've no place to complain.  ",43,32,0.8,Liberal,raidyredSL,https://www.reddit.com/r/Liberal/comments/1nlvhfk/a_better_way/,https://www.reddit.com/r/Liberal/comments/1nlvhfk/a_better_way/,Iran Says It Will Halt Attacks On Neighbours; Trump Calls,Iran Says It Will Halt Attacks On Neighbours; Trump Calls Them The 'Loser of Middle East',ndtv,https://www.ndtvprofit.com/world/iran-says-it-will-halt-attacks-on-neighbours-trump-views-it-a-surrender-11182213,2025-09-20 11:14:45
1nls9co,Rules for thee not for me. Hypocrisy of Canceling Kimmel,"Rules for thee not for me. Jimmy Kimmel free speech argument is huge hypocrisy by the left loons.  




*""ABC News pulled Jimmy Kimmel off the air on Wednesday. Not for being painfully unfunny, and not even for having an opinion. No, Kimmel got yanked because he flat-out lied and claimed: “the MAGA gang desperately \[is\] trying to characterize this kid who murdered Charlie Kirk as anything other than one of them and doing everything they can to score political points from it.”*  


*It was a pure lie. Following widespread criticism, Nextstar Media Group* [*said*](https://www.cnbc.com/2025/09/17/charlie-kirk-jimmy-kimmel-abc-disney.html) *its ABC affiliate stations would not run Kimmel’s show over the comments.*

*FCC commissioner* [*Brendan Carr*](https://thefederalist.com/2025/09/17/jimmy-kimmel-blatantly-broke-fcc-rules-and-brendan-carr-was-right-to-notice/) *noted ABC could face repercussions, but he didn’t force ABC to do anything. ABC made the call on its own — whether to protect its bottom line or because it knew it would lose in court. Notably, FCC* [*regulations*](https://www.fcc.gov/media/radio/public-and-broadcasting#JOURNALISM) *prohibit news distortion or a hoax. A station’s broadcast violates the FCC’s rules if “the station licensee knew that the information was false” or if “broadcasting the false information directly causes substantial public harm…”*

*Nonetheless, the professional censorship class on the left has suddenly discovered the First Amendment.*

[*Harry Sisson*](https://x.com/harryjsisson/status/1968447006155624679) *took to X to claim “We are witnessing the most brazen attack on free speech in modern American history. Elon, Trump, and MAGA said they were free speech warriors. It’s the exact opposite.”*

*Matt Yglesias* [*wrote on an entire*](https://x.com/mattyglesias/status/1968667251747279000) *article about “MAGA’s scary clampdown on free speech.”*

[*David French*](https://x.com/DavidAFrench/status/1968416136464073102) *called Kimmel’s removal a “direct attack on free speech.”*

*Vox’s* [*Zack Beauchamp*](https://www.vox.com/politics/461887/jimmy-kimmel-suspension-air-abc-charlie-kirk-nexstar) *wrote Kimmel’s removal is the “most brazen attack on free speech yet.”*

*But where was this passion for “free speech” when ABC canceled the hit sitcom “Roseanne” in 2018 after Roseanne Barr* [*referred*](https://variety.com/video/roseanne-canceled-racist-tweets/) *to former Obama aide Valerie Jarrett as the offspring of the “Muslim Brotherhood & Planet of the Apes.”*

*The left cheered the cancellation, with French* [*posting*](https://x.com/DavidAFrench/status/1001523761747816450)*: “Roseanne canceled. Who could have possibly foreseen that a toxic person would be so toxic?”*

*No handwringing about censorship then.*

*Where were the hysterics when President Donald Trump was* [*deplatformed*](https://thefederalist.com/2022/12/12/twitter-employees-found-trump-didnt-violate-policies-then-banned-him-anyway-with-corporate-medias-help/) *in 2021? The “Twitter Files” even revealed that Twitter employees acknowledged on internal channels that Trump’s tweets after January 6 did not violate any policies — yet they banned him anyway.*

*The left celebrated.*

*Yglesias* [*reportedly*](https://countercurrents.org/2022/08/following-raid-in-trumps-home-the-far-right-calls-for-civil-war-in-the-u-s/) *had no problem with the silencing of free speech, posting “It’s kinda weird that deplatforming Trump just like completely worked with no visible downside whatsoever.”*

*French* [*said*](https://x.com/_ellepurnell/status/1968693273645478304) *it was an “actual exercise of liberty,” and called the suppression of free speech “appropriate.”*

*Vox’s* [*Aja Romano*](https://www.vox.com/culture/22230847/deplatforming-free-speech-controversy-trump) *reassured Americans that deplatforming Trump isn’t a free speech issue. Rather, it is “effective at rousting extremists from mainstream internet spaces. It’s not a violation of the First Amendment.”*

*When Megyn Kelly was fired by NBC in 2018 after Kelly* [*questioned*](https://apnews.com/article/a84a7250b109411591ed6b976be800a0) *whether blackface Halloween costumes were always racist, The New Yorker’s Doreen St. Félix* [*mocked*](https://www.newyorker.com/culture/culture-desk/nbcs-firing-of-megyn-kelly-is-as-cynical-as-her-hiring-was) *her, writing: “But Kelly is shrewd in plenty of other ways. In the next phase of her career, perhaps she will use her firing to fashion herself into a martyr for the so-called suppression of free speech.”*

*No defenders of free expression, no cries about censorship, just applause.*

*And let’s not forget the Biden administration’s censorship machine, exposed in* [*Missouri v. Biden*](https://thefederalist.com/2025/01/22/mark-zuckerberg-confirmed-the-supreme-court-ignored-direct-evidence-of-massive-federal-censorship-scheme/) *— later known as Murthy v. Missouri. The administration and federal agencies coerced and colluded directly and indirectly with social media companies to censor things they didn’t like on a litany of topics, such as Hunter Biden’s laptop, election integrity, and Covid-19. In fact, Meta CEO Mark Zuckerberg later admitted on The Joe Rogan Experience that Meta was complicit in the censorship.*

*Speaking of the Hunter Biden laptop, no one raised any alarms when conservatives were being locked out of their Twitter accounts for sharing the New York Post’s bombshell story. In fact, left-wing media outlets gave cover to Big Tech, with* [*NPR*](https://www.npr.org/2020/10/15/924150245/twitter-and-facebook-limit-access-to-a-new-york-post-story-on-biden-s-son) *framing their reporting on the censorship as Twitter and Facebook merely limiting “the reach of an article with unconfirmed claims” before couching that with a note that so-called “experts warn that social media platforms are full of misinformation and conspiracy theories.”*

*No one clutched the First Amendment when The Federalist’s John Daniel Davidson* [*was locked*](https://thefederalist.com/2022/03/30/twitter-locked-my-account-for-telling-the-truth-about-rachel-levine/) *out of his Twitter account for stating the obvious fact that then-U.S. Assistant Secretary for Health Rachel Levine is a man. It was near radio silence from the left when YouTube* [*censored*](https://thefederalist.com/2021/08/11/youtube-will-censor-you-if-you-disagree-with-the-government-even-if-youre-in-the-government/) *Sen. Rand Paul for disagreeing with the government about CDC guidance.*

*So why the sudden panic now when a private company makes a determination on its own to pull a host for spreading egregious lies (and possibly violating the law)?*

*Partially because it’s one of their own. But even more so because, as Rahm Emanuel once said, never let a crisis go to waste. The left doesn’t really care about Kimmel or free speech. But by pretending that this is some unprecedented Trump crackdown, they get to smear Trump as a dictator or authoritarian to delegitimize his presidency. It’s not about defending free speech, it’s just about exploiting a convenient storyline to keep their narrative of Trump-is-authoritarian alive.""*



*the federalist.*



[https://thefederalist.com/2025/09/18/6-times-leftists-melting-down-over-jimmy-kimmel-were-happy-to-deny-conservatives-free-speech/](https://thefederalist.com/2025/09/18/6-times-leftists-melting-down-over-jimmy-kimmel-were-happy-to-deny-conservatives-free-speech/)",73,64,0.72,Conservative,Fuzzy_Firefighter_51,https://www.reddit.com/r/Conservative/comments/1nls9co/rules_for_thee_not_for_me_hypocrisy_of_canceling/,https://www.reddit.com/r/Conservative/comments/1nls9co/rules_for_thee_not_for_me_hypocrisy_of_canceling/,Iran Says It Will Halt Attacks On Neighbours; Trump Calls,Iran Says It Will Halt Attacks On Neighbours; Trump Calls Them The 'Loser of Middle East',ndtv,https://www.ndtvprofit.com/world/iran-says-it-will-halt-attacks-on-neighbours-trump-views-it-a-surrender-11182213,2025-09-20 07:56:31
