post_id,title,selftext,score,num_comments,upvote_ratio,subreddit,author,post_url,external_url,search_query,matched_news_title,matched_news_source,matched_news_url,created_utc
1rnf5nn,"Trump vows to hit ‘very hard’ after Iran’s president says he won’t surrender “Under serious consideration for complete destruction and certain death,” he says.",,214,135,0.9,politics,brithus,https://www.reddit.com/r/politics/comments/1rnf5nn/trump_vows_to_hit_very_hard_after_irans_president/,https://www.politico.com/news/2026/03/07/trump-iran-threat-military-strike-surrender-00818032,Trump says Iran has “surrendered” to neighbors after U.S.-Israel attacks,Trump says Iran has “surrendered” to neighbors after U.S.-Israel attacks,investing_us,https://www.investing.com/news/general-news/trump-says-iran-has-surrendered-to-neighbors-after-usisrael-attacks-4548500,2026-03-07 17:04:33
1rnbgos,Will Gulf states reconsider their investment plans or demand compensation from the US?,"The war involving Israel, the United States, and Iran has now expanded to affect much of the Middle East.

For years, Gulf countries allowed the United States to build military bases and installations on their territory as part of security arrangements intended to protect the region. However, within just a week of the current escalation, several of these states have reportedly suffered significant material and reputational damage. There are also growing concerns that the situation could deteriorate further.

Kuwait has already shut down what is reported to be the world’s largest LNG export facility.  
[https://www.bloomberg.com/news/articles/2026-03-02/european-gas-rallies-more-than-30-as-qatar-halts-lng-production](https://www.bloomberg.com/news/articles/2026-03-02/european-gas-rallies-more-than-30-as-qatar-halts-lng-production)

At the same time, Qatar has warned that oil production across the Gulf could be disrupted within weeks if the conflict continues to escalate.  
[https://www.bbc.com/news/articles/cy031ylgepro](https://www.bbc.com/news/articles/cy031ylgepro)

Some Gulf states have reportedly expressed frustration that the United States has not adequately protected their territory, alleging that key missile defense resources have been prioritized for Israel instead.  
[https://thecradle.co/articles-id/36325](https://thecradle.co/articles-id/36325)

After U.S. President Donald Trump visited the Gulf states in May 2025, he announced investment agreements with Saudi Arabia, Qatar, and the United Arab Emirates totaling more than $2 trillion.  
[https://www.bbc.com/news/articles/cn5yxp2v77ro](https://www.bbc.com/news/articles/cn5yxp2v77ro)

If the regional conflict continues to escalate and damage to Gulf countries grows, will these states reconsider their investment plans—or even seek compensation related to the security guarantees tied to their partnership with the United States?",1,6,0.56,PoliticalDiscussion,Only-Deal-881,https://www.reddit.com/r/PoliticalDiscussion/comments/1rnbgos/will_gulf_states_reconsider_their_investment/,https://www.reddit.com/r/PoliticalDiscussion/comments/1rnbgos/will_gulf_states_reconsider_their_investment/,Iran Says It Will Halt Attacks On Neighbours; Trump Calls,Iran Says It Will Halt Attacks On Neighbours; Trump Calls Them The 'Loser of Middle East',ndtv,https://www.ndtvprofit.com/world/iran-says-it-will-halt-attacks-on-neighbours-trump-views-it-a-surrender-11182213,2026-03-07 14:34:32
1rnamdd,Trump Says Iran Will Be ‘Hit Very Hard' On Saturday,,322,86,0.91,politics,No-Post4444,https://www.reddit.com/r/politics/comments/1rnamdd/trump_says_iran_will_be_hit_very_hard_on_saturday/,https://www.huffpost.com/entry/trump-says-iran-will-be-hit-very-hard-on-saturday_n_69ac2667e4b00d350bef67ab,Iran Says It Will Halt Attacks On Neighbours; Trump Calls,Iran Says It Will Halt Attacks On Neighbours; Trump Calls Them The 'Loser of Middle East',ndtv,https://www.ndtvprofit.com/world/iran-says-it-will-halt-attacks-on-neighbours-trump-views-it-a-surrender-11182213,2026-03-07 13:57:17
1rlz0vm,"Here in San Diego, we were once a red city, but now we're blue.  With blue ""leadership"" as far as the eye can see.  What's that mean for the city's budget?","Of course, it's hundreds of millions of dollars short, because we have many wonderful social programs that can't \*possibly\* be cut or reduced.  This means that, in order to make up shortfalls, we must tax our residents as much as possible with a litany of new fees.

We now have to pay for parking at Balboa Park for the first time ever (some more distant lots are free for SD residents, due to public pressure, but they must register and pay a fee).

They also added trash pickup fees, again, for the first time ever.

They've also considered charging for beach parking, but they might be slow to implement, considering how much flack they've taken for charging to park at Balboa park.

They're further talking about taxing 2nd homes, and a minimum $8,000 tax for many homes that are unoccupied.  If that was in place while my mom was ill, we might have gotten hit with a $32,000 tax bill, since she wasn't living there, and the home was not in a condition to be rented, nor were we in a position to refurbish it.

This Nextdoor member has come up with an amazing plan to generate a lot of new tax and fee revenue for the deeply indebted City of San Diego...

City identifies new revenue stream!

A recent scientific development has given the city council hope for a new revenue stream. Researchers at the University of Maryland have created ""smart underwear"" that provides an accurate count of the frequency of the wearer's flatulence.  In short, it counts farts.

Always eager to squeeze more cash out of San Diego's citizens, the city council is looking into requiring all San Diegans to wear the new sensor. The city can then charge the wearer a fee for every time they pass gas. ""This will not only help us avoid balancing a budget,"" said city councilman Sean Elo-Rivera, ""it will also help us reach our climate goals by creating an incentive for people to produce less of those noxious greenhouse gases.""

Mayor Todd Gloria is enthusiastic about this new venture and has already committed the city to purchasing at least one million of the devices, sight unseen, and will begin distributing them as soon as possible.

Gloria said that they can work out the details later, and come up with a complex plan to allow some people to fart for free, if they sign up online one year in advance, pay a $5 fee, and provide a driver's license, a notarized letter from a proctologist or gastroenterologist, and can account for every ounce of fiber they've eaten in the past five years.",18,16,0.7,Conservative,Stockjock1,https://www.reddit.com/r/Conservative/comments/1rlz0vm/here_in_san_diego_we_were_once_a_red_city_but_now/,https://www.reddit.com/r/Conservative/comments/1rlz0vm/here_in_san_diego_we_were_once_a_red_city_but_now/,Pezeshkian further said that neighbouring countries will not,Iran Says It Will Halt Attacks On Neighbours; Trump Calls Them The 'Loser of Middle East',ndtv,https://www.ndtvprofit.com/world/iran-says-it-will-halt-attacks-on-neighbours-trump-views-it-a-surrender-11182213,2026-03-06 00:34:22
1rlvtyy,"Trump Says 'I Guess' Americans Should Worry About Iran Retaliating on U.S. Soil: 'Like I Said, Some People Will Die'",,33181,2301,0.96,politics,peoplemagazine,https://www.reddit.com/r/politics/comments/1rlvtyy/trump_says_i_guess_americans_should_worry_about/,https://people.com/trump-says-i-guess-americans-should-worry-about-iran-attacks-11920588?utm_campaign=peoplemagazine&utm_medium=social&utm_source=reddit.com&utm_content=post,Iran Says It Will Halt Attacks On Neighbours; Trump Calls,Iran Says It Will Halt Attacks On Neighbours; Trump Calls Them The 'Loser of Middle East',ndtv,https://www.ndtvprofit.com/world/iran-says-it-will-halt-attacks-on-neighbours-trump-views-it-a-surrender-11182213,2026-03-05 22:26:04
1rlq5a8,AOC Says Trump is Willing to ‘Risk World War’ by Using Iran Attack as Epstein Files Distraction,,1296,25,0.97,politics,T_Shurt,https://www.reddit.com/r/politics/comments/1rlq5a8/aoc_says_trump_is_willing_to_risk_world_war_by/,https://www.independent.co.uk/news/world/americas/us-politics/aoc-trump-epstein-files-iran-b2932780.html?test_group=lighteradlayout,Iran Says It Will Halt Attacks On Neighbours; Trump Calls,Iran Says It Will Halt Attacks On Neighbours; Trump Calls Them The 'Loser of Middle East',ndtv,https://www.ndtvprofit.com/world/iran-says-it-will-halt-attacks-on-neighbours-trump-views-it-a-surrender-11182213,2026-03-05 18:54:54
1rlph8z,AOC says Trump is willing to ‘risk world war’ by using Iran attack as Epstein files distraction,,14469,344,0.98,politics,plz-let-me-in,https://www.reddit.com/r/politics/comments/1rlph8z/aoc_says_trump_is_willing_to_risk_world_war_by/,https://www.the-independent.com/news/world/americas/us-politics/aoc-trump-epstein-files-iran-b2932780.html,Iran Says It Will Halt Attacks On Neighbours; Trump Calls,Iran Says It Will Halt Attacks On Neighbours; Trump Calls Them The 'Loser of Middle East',ndtv,https://www.ndtvprofit.com/world/iran-says-it-will-halt-attacks-on-neighbours-trump-views-it-a-surrender-11182213,2026-03-05 18:31:12
1rl742k,"US will ‘rain missiles’, ‘death and destruction’ on Iran, Trump aides say",,21,41,0.69,politics,Parking_Clerk7039,https://www.reddit.com/r/politics/comments/1rl742k/us_will_rain_missiles_death_and_destruction_on/,https://www.aljazeera.com/amp/news/2026/3/4/us-will-rain-missiles-death-and-destruction-on-iran-trump-aides-say,Iran Says It Will Halt Attacks On Neighbours; Trump Calls,Iran Says It Will Halt Attacks On Neighbours; Trump Calls Them The 'Loser of Middle East',ndtv,https://www.ndtvprofit.com/world/iran-says-it-will-halt-attacks-on-neighbours-trump-views-it-a-surrender-11182213,2026-03-05 03:47:32
1rk41y0,"Discussion Thread: March, 3rd 2026 - Midterm Elections","Today voters take to the polls in Arizona, Arkansas, Delaware, Florida, Georgia, Illinois, Iowa, Kansas, Louisiana, Maine, Massachusetts, New Mexico, North Carolina, Oregon, Seaside, Pennsylvania, South Carolina, Texas, Utah, Vermont, Virginia, and Wyoming.  
  
Live coverage is available from, but not limited to, [AP News](https://apnews.com/live/election-primary-3-3-2026), [Texas Tribune](https://apps.texastribune.org/features/2026/primary-election-results-2026/), [KXAN](https://www.kxan.com/news/your-local-election-hq/march-2026-election-live-blog/), [ABC News](https://abcnews.com/Elections), [NBC](https://www.nbcnews.com/politics/2026-primary-elections/texas-senate-results), [The New Yorker](https://www.newyorker.com/news/election-2026/texas-primary-map-live-election-results), [Austin-American Statesman](https://www.statesman.com/projects/2026/texas-primary-election-live-results/), [El Paso Times](https://www.elpasotimes.com/story/news/politics/elections/2026/03/03/election-day-2026-in-texas-live-results-updates-from-el-paso-county/88952969007/), [Texas Public Radio](https://www.tpr.org/2026-03-03/live-primary-election-results-bexar-county-and-texas), and [CNN](https://www.cnn.com/election/2026).  Live analysis also available on YouTube from [NBC's Steve Kornacki](https://www.youtube.com/watch?v=0NzxJ5DJOPM).",111,2569,0.95,politics,PoliticsModeratorBot,https://www.reddit.com/r/politics/comments/1rk41y0/discussion_thread_march_3rd_2026_midterm_elections/,https://www.reddit.com/r/politics/comments/1rk41y0/discussion_thread_march_3rd_2026_midterm_elections/,"NEW DELHI, 07 March, 2026: India’s Joint Platform",India’s trade unions condemn US-Israeli aggression on Iran,southasiatimes_au,https://www.southasiatimes.com.au/south-asia/india/central-trade-unions/,2026-03-03 22:42:34
1rk2y3j,"Trump Says US Will Escort Oil Tankers, Offer Insurance After Iran Attacks",,43,60,0.77,politics,Arcool_1,https://www.reddit.com/r/politics/comments/1rk2y3j/trump_says_us_will_escort_oil_tankers_offer/,https://www.bloomberg.com/news/articles/2026-03-03/trump-says-us-will-escort-insure-oil-tankers-amid-iran-war,Iran Says It Will Halt Attacks On Neighbours; Trump Calls,Iran Says It Will Halt Attacks On Neighbours; Trump Calls Them The 'Loser of Middle East',ndtv,https://www.ndtvprofit.com/world/iran-says-it-will-halt-attacks-on-neighbours-trump-views-it-a-surrender-11182213,2026-03-03 21:59:38
1rjw778,"Pete Hegseth’s Crazed, Angry Tirades on Iran Give Dems a Big Opening: It’s not enough for Democrats to say Trump’s war rationales haven’t been fully explained. The problem is that they are patently false.",,204,16,0.96,politics,thenewrepublic,https://www.reddit.com/r/politics/comments/1rjw778/pete_hegseths_crazed_angry_tirades_on_iran_give/,https://newrepublic.com/article/207224/pete-hegseth-angry-iran-democrats-opening,Iran Says It Will Halt Attacks On Neighbours; Trump Calls,Iran Says It Will Halt Attacks On Neighbours; Trump Calls Them The 'Loser of Middle East',ndtv,https://www.ndtvprofit.com/world/iran-says-it-will-halt-attacks-on-neighbours-trump-views-it-a-surrender-11182213,2026-03-03 17:53:05
1rjq5wj,Rutte says NATO will stay out of attacks on Iran,,80,17,0.85,Conservative,Mike4Maga,https://www.reddit.com/r/Conservative/comments/1rjq5wj/rutte_says_nato_will_stay_out_of_attacks_on_iran/,https://seekingalpha.com/news/4559821-rutte-backs-u-s-israel-strikes-on-iran-says-nato-will-stay-out-of-fight,Iran Says It Will Halt Attacks On Neighbours; Trump Calls,Iran Says It Will Halt Attacks On Neighbours; Trump Calls Them The 'Loser of Middle East',ndtv,https://www.ndtvprofit.com/world/iran-says-it-will-halt-attacks-on-neighbours-trump-views-it-a-surrender-11182213,2026-03-03 14:04:10
1rj04w7,Our soldiers are dying but Trump has his eyes on what matters… bragging about his billionaire ballroom smh,,475,17,0.98,democrats,Paneraiguy1,https://www.reddit.com/r/democrats/comments/1rj04w7/our_soldiers_are_dying_but_trump_has_his_eyes_on/,https://i.redd.it/qmmvk60x8omg1.jpeg,Iran Says It Will Halt Attacks On Neighbours; Trump Calls,Iran Says It Will Halt Attacks On Neighbours; Trump Calls Them The 'Loser of Middle East',ndtv,https://www.ndtvprofit.com/world/iran-says-it-will-halt-attacks-on-neighbours-trump-views-it-a-surrender-11182213,2026-03-02 18:02:52
1rits9e,"UK ‘took far too long’ to let US use its airbases to attack Iran, Trump says",,0,25,0.29,politics,Zipper222222,https://www.reddit.com/r/politics/comments/1rits9e/uk_took_far_too_long_to_let_us_use_its_airbases/,https://www.theguardian.com/world/2026/mar/02/uk-airbases-us-attack-iran-trump-starmer,Iran Says It Will Halt Attacks On Neighbours; Trump Calls,Iran Says It Will Halt Attacks On Neighbours; Trump Calls Them The 'Loser of Middle East',ndtv,https://www.ndtvprofit.com/world/iran-says-it-will-halt-attacks-on-neighbours-trump-views-it-a-surrender-11182213,2026-03-02 14:08:27
1rigaxi,Video: Trump says strikes on Iran will continue until US objectives achieved,,611,129,0.82,Conservative,WillyNilly1997,https://www.reddit.com/r/Conservative/comments/1rigaxi/video_trump_says_strikes_on_iran_will_continue/,https://www.iranintl.com/en/202603028704,Iran Says It Will Halt Attacks On Neighbours; Trump Calls,Iran Says It Will Halt Attacks On Neighbours; Trump Calls Them The 'Loser of Middle East',ndtv,https://www.ndtvprofit.com/world/iran-says-it-will-halt-attacks-on-neighbours-trump-views-it-a-surrender-11182213,2026-03-02 02:09:54
1riann6,Top Dem Is Painfully Clear About Who Will Pay The Price For War On Iran — And It Won't Be Trump And Company,,1017,54,0.96,politics,huffpost,https://www.reddit.com/r/politics/comments/1riann6/top_dem_is_painfully_clear_about_who_will_pay_the/,https://www.huffpost.com/entry/chris-murphy-poor-middle-class-die-iran-war_n_69a479f8e4b0d383f503749a?utm_medium=Social&utm_source=reddit&utm_campaign=us_main,Iran Says It Will Halt Attacks On Neighbours; Trump Calls,Iran Says It Will Halt Attacks On Neighbours; Trump Calls Them The 'Loser of Middle East',ndtv,https://www.ndtvprofit.com/world/iran-says-it-will-halt-attacks-on-neighbours-trump-views-it-a-surrender-11182213,2026-03-01 22:06:47
1rhpqxe,"U.S. and Israel launch a major attack on Iran, Trump says Supreme Leader Khamenei killed",,40,21,0.77,politics,my_vision_vivid,https://www.reddit.com/r/politics/comments/1rhpqxe/us_and_israel_launch_a_major_attack_on_iran_trump/,https://www.pbs.org/newshour/world/u-s-and-israel-launch-a-major-attack-on-iran-trump-says-supreme-leader-khamenei-killed,Iran Says It Will Halt Attacks On Neighbours; Trump Calls,Iran Says It Will Halt Attacks On Neighbours; Trump Calls Them The 'Loser of Middle East',ndtv,https://www.ndtvprofit.com/world/iran-says-it-will-halt-attacks-on-neighbours-trump-views-it-a-surrender-11182213,2026-03-01 06:12:27
1rhpqto,"U.S. and Israel launch a major attack on Iran, Trump says Supreme Leader Khamenei killed",,16,2,0.69,Conservative,my_vision_vivid,https://www.reddit.com/r/Conservative/comments/1rhpqto/us_and_israel_launch_a_major_attack_on_iran_trump/,https://www.pbs.org/newshour/world/u-s-and-israel-launch-a-major-attack-on-iran-trump-says-supreme-leader-khamenei-killed,Iran Says It Will Halt Attacks On Neighbours; Trump Calls,Iran Says It Will Halt Attacks On Neighbours; Trump Calls Them The 'Loser of Middle East',ndtv,https://www.ndtvprofit.com/world/iran-says-it-will-halt-attacks-on-neighbours-trump-views-it-a-surrender-11182213,2026-03-01 06:12:16
1rhe1rc,Interesting....,,73,12,0.91,Conservative,SOLIDORKS,https://www.reddit.com/r/Conservative/comments/1rhe1rc/interesting/,https://i.redd.it/scdyaqevvamg1.png,Iran Says It Will Halt Attacks On Neighbours; Trump Calls,Iran Says It Will Halt Attacks On Neighbours; Trump Calls Them The 'Loser of Middle East',ndtv,https://www.ndtvprofit.com/world/iran-says-it-will-halt-attacks-on-neighbours-trump-views-it-a-surrender-11182213,2026-02-28 21:06:54
1rhb2rc,They voted to stop war /s,,230,38,0.98,democrats,nanoatzin,https://www.reddit.com/r/democrats/comments/1rhb2rc/they_voted_to_stop_war_s/,https://i.redd.it/r2xb6k6vaamg1.jpeg,Iran Says It Will Halt Attacks On Neighbours; Trump Calls,Iran Says It Will Halt Attacks On Neighbours; Trump Calls Them The 'Loser of Middle East',ndtv,https://www.ndtvprofit.com/world/iran-says-it-will-halt-attacks-on-neighbours-trump-views-it-a-surrender-11182213,2026-02-28 19:08:52
1rh9vsz,Gulf states condemn Iranian retaliatory strikes on their territories following US-Israeli operation- Many Arab nations warn of 'full right to respond' after being Iran's retaliatory strikes,,64,7,0.88,Conservative,Down-not-out,https://www.reddit.com/r/Conservative/comments/1rh9vsz/gulf_states_condemn_iranian_retaliatory_strikes/,https://www.foxnews.com/world/gulf-states-condemn-iranian-retaliatory-strikes-territories-following-us-israeli-operation,India’s trade unions condemn US-Israeli aggression on Iran,India’s trade unions condemn US-Israeli aggression on Iran,southasiatimes_au,https://www.southasiatimes.com.au/south-asia/india/central-trade-unions/,2026-02-28 18:22:42
1rh6gzn,"Trump launches attack on Iran in coordination with Netanyahu claiming regime change and dismantling of all its missiles and nuclear capacity.  Iran has responded by attacking multiple air and naval bases in the Middle East. Are we heading towards another forever war, without much to show for it?","So far, the attack and responses are primarily missiles based and does not appear to have utilized air force. It could be due to preparation for a long-term war and conservation. 

According to Trump this is a major operation, but it is far more tepid than the one in June of 2025; nothing in compared to what would be expected in a major operation. 

Are we heading towards another forever war without much to show for it?

[Israel and US launch a major attack on Iran | AP News](https://apnews.com/article/iran-us-explosion-tehran-c2f11247d8a66e36929266f2c557a54c)

[https://www.washingtonpost.com/world/2026/02/28/israel-strikes-iran-live-updates/](https://www.washingtonpost.com/world/2026/02/28/israel-strikes-iran-live-updates/)

",748,492,0.95,PoliticalDiscussion,PsychLegalMind,https://www.reddit.com/r/PoliticalDiscussion/comments/1rh6gzn/trump_launches_attack_on_iran_in_coordination/,https://www.reddit.com/r/PoliticalDiscussion/comments/1rh6gzn/trump_launches_attack_on_iran_in_coordination/,Iran Says It Will Halt Attacks On Neighbours; Trump Calls,Iran Says It Will Halt Attacks On Neighbours; Trump Calls Them The 'Loser of Middle East',ndtv,https://www.ndtvprofit.com/world/iran-says-it-will-halt-attacks-on-neighbours-trump-views-it-a-surrender-11182213,2026-02-28 16:09:41
1rgjkc0,"US attack on Iran may or may not lead to regime change, Trump says",,94,19,0.86,Conservative,WillyNilly1997,https://www.reddit.com/r/Conservative/comments/1rgjkc0/us_attack_on_iran_may_or_may_not_lead_to_regime/,https://www.iranintl.com/en/202602274390,Iran Says It Will Halt Attacks On Neighbours; Trump Calls,Iran Says It Will Halt Attacks On Neighbours; Trump Calls Them The 'Loser of Middle East',ndtv,https://www.ndtvprofit.com/world/iran-says-it-will-halt-attacks-on-neighbours-trump-views-it-a-surrender-11182213,2026-02-27 21:31:30
1rg08r4,JD Vance says 'no chance' a US attack on Iran will lead to long war with 'no end in sight',,81,14,0.84,Conservative,Eastern-Algae-5557,https://www.reddit.com/r/Conservative/comments/1rg08r4/jd_vance_says_no_chance_a_us_attack_on_iran_will/,https://nypost.com/2026/02/26/us-news/jd-vance-says-no-chance-a-us-attack-on-iran-will-lead-to-long-war-with-no-end-in-sight/,Iran Says It Will Halt Attacks On Neighbours; Trump Calls,Iran Says It Will Halt Attacks On Neighbours; Trump Calls Them The 'Loser of Middle East',ndtv,https://www.ndtvprofit.com/world/iran-says-it-will-halt-attacks-on-neighbours-trump-views-it-a-surrender-11182213,2026-02-27 07:32:45
1rfz39n,MAGA Loves Taxation Without Representation,,81,5,0.99,democrats,LAMBEAUghiniMercy,https://www.reddit.com/r/democrats/comments/1rfz39n/maga_loves_taxation_without_representation/,https://i.redd.it/swd7j9kodzlg1.jpeg,Iran Says It Will Halt Attacks On Neighbours; Trump Calls,Iran Says It Will Halt Attacks On Neighbours; Trump Calls Them The 'Loser of Middle East',ndtv,https://www.ndtvprofit.com/world/iran-says-it-will-halt-attacks-on-neighbours-trump-views-it-a-surrender-11182213,2026-02-27 06:25:02
1res67l,Trump uses State of the Union to attack trans rights and calls for ban on schools allowing social transitioning. LGBT+ groups say ‘forced outing’ endangers vulnerable gender nonconfirming teens in unsupportive families,,119,22,0.9,politics,southpawFA,https://www.reddit.com/r/politics/comments/1res67l/trump_uses_state_of_the_union_to_attack_trans/,https://www.independent.co.uk/news/world/americas/us-politics/trump-sage-blair-transgender-ban-b2927528.html,Iran Says It Will Halt Attacks On Neighbours; Trump Calls,Iran Says It Will Halt Attacks On Neighbours; Trump Calls Them The 'Loser of Middle East',ndtv,https://www.ndtvprofit.com/world/iran-says-it-will-halt-attacks-on-neighbours-trump-views-it-a-surrender-11182213,2026-02-25 22:31:25
