post_id,title,selftext,score,num_comments,upvote_ratio,subreddit,author,post_url,external_url,search_query,matched_news_title,matched_news_source,matched_news_url,created_utc
1py9gta,Geopolitics (Projections): What happens after today’s long-standing heads of state are gone while fixation is on the current state?,"A lot of attention (understandably) is focused on U.S. internal politics, but it feels like we talk far less about the global leaders we’ve grown accustomed to—India, Russia, China, North Korea, etc.—and what happens when those familiar figures pass on or are suddenly removed from the picture.
Many of these leaders have been in power long enough that their personal image has become intertwined with their state’s identity. That creates a sense of complacency, as if the external world will remain mostly “the same,” just older, while we argue internally.
My question is less about who replaces them and more about direction:
How much continuity vs. rupture should we realistically expect in each case?
Are these systems stable enough to absorb leadership loss, or are they more fragile than they appear?
During transitions, is the greater risk internal instability, external aggression, or elite power struggles behind the scenes?
How do cult-of-personality systems evolve once the central figure is gone—do they dissolve, harden, or mutate?
It seems like multiple major leadership transitions could happen within the same decade. Are we underestimating how disruptive that overlap could be globally?
Would appreciate perspectives that look beyond U.S. politics alone and focus on succession dynamics, institutional strength, and historical precedent but also how it will affect the current U.S. atmosphere at any given moment.",16,11,0.81,PoliticalDiscussion,WhatEnZaWorld,https://www.reddit.com/r/PoliticalDiscussion/comments/1py9gta/geopolitics_projections_what_happens_after_todays/,https://www.reddit.com/r/PoliticalDiscussion/comments/1py9gta/geopolitics_projections_what_happens_after_todays/,India's rise is 'unstoppable' and it alone will determine trajectory,India's rise is 'unstoppable' and it alone will determine trajectory of its growth: Jaishankar,deccanherald,https://www.deccanherald.com/india/indias-rise-is-unstoppable-and-it-alone-will-determine-trajectory-of-its-growth-jaishankar-3923235,2025-12-29 02:02:53
1py506o,"Are States in Resistance, Insurrection or Rebellion to the Federal Government?","Starting in 2017 we had the Resistance to T45. That movement featured efforts by the bench, many bureaucrats and some politicians to stymie the Republicans through delaying or slow walking their Administration. Everyone saw that as typical political action and no one imagined it to be illegal. 

In 2021 we saw an attack on the Capitol. That of course was a bunch of citizens who tried to stop certification of the election of the Democratic ticket. Some of the opponents committed criminal acts, and Trump was impeached for his role of inciting the crowd. Most people at the time saw the incident as illegitimate and the event was labeled an Insurrection. 

Now in 2025 a group of states led by their political leadership are opposing the Administration’s immigration policies as well as other federal actions. They have passed state laws, have refused cooperation, and have extended help to people to evade positions taken by this Administration. Of course anyone can advocate for any position, but all States are constitutionally subservient to the federal system. Actual opposition by states to the government of the United States is called a Rebellion. Cf. The Civil War. 

So, Questions:

     1.  Are the current States that dissent from and take action to oppose the Administration’s immigration policies in a state of Rebellion? 

     2.  What consequences if any should be imposed on those States actively opposing the Administration’s immigration policies? 

     3.  What consequences if any should individual politicians face for actively opposing the Administration’s immigration policies? 

     4.  What process would be needed to determine and to penalize States and politicians who take actions to oppose the Administration’s immigration policies? 

Of course, this discussion revolves in large part around Amendment 14, Section 3. ",0,28,0.31,PoliticalDiscussion,Conscious_Skirt_61,https://www.reddit.com/r/PoliticalDiscussion/comments/1py506o/are_states_in_resistance_insurrection_or/,https://www.reddit.com/r/PoliticalDiscussion/comments/1py506o/are_states_in_resistance_insurrection_or/,Iran Says It Will Halt Attacks On Neighbours; Trump Calls,Iran Says It Will Halt Attacks On Neighbours; Trump Calls Them The 'Loser of Middle East',ndtv,https://www.ndtvprofit.com/world/iran-says-it-will-halt-attacks-on-neighbours-trump-views-it-a-surrender-11182213,2025-12-28 22:48:35
1psktv9,How can France deal with its debt crisis?,"On Friday, French lawmakers rejected the budget proposal of Premier Sébastien Lecornu, which means that France is heading into 2026 without a budget, and the government will be forced to fall back on emergency measures to cover its expenses.

This comes at the worst possible time as France is grappling with a crushing debt crisis. As of 2025, French public debt stands at 117% of GDP. In 2024, the government ran a deficit of 5.8% of GDP, after a 5.4% deficit in 2023. For this year, the deficit is projected to come in at 5.5% of GDP. Clearly, the current trajectory France is on is not sustainable, and bond markets have already reacted accordingly with France's bond yields surpassing those of Greece and Italy - two countries that have to actually deal with higher debt-to-GDP ratios than France.

Servicing costs have soared as a result to €60 billion this year - more than double the €25 billion from five years ago.

With a stalling economy, the only way for the government to balance its books seems to be to cut spending and/or raise taxes, but neither appears a politically feasible option at the moment. President Macron's _Renaissance_ party lost its working majority at the 2022 legislative election, and lost an additional 86 seats at the 2024 snap election, making him dependant on other parties in the National Assembly to get any legislation passed.

The two other big blocks in parliament are the New Popular Front (_Nouveau Front populaire_), a broad alliance of both moderate and more radical left-wing parties, and the populist right-wing National Rally (_Rassemblement national_). Both the left and the right ran on platforms calling for increases to government spending, and neither side has really budged on the issue. Previous attempts by Macron to cut costs, notably his attempt at pension reform in 2023, were met with virulent opposition, and Lecornu had to suspend the pension reform in November in an attempt to strike a deal with the NFP.

It seems clear that significant spending cuts aren't tolerable to the French public right now, but neither is any significant new debt to the bond markets.

What I'd like to get your perspective on is what options there are to break the gridlock. Should Macron consider appointing a prime minister from one of the NFP parties to try to make its more moderate members amenable to spending cuts? Could Macron call another snap election, if only to exit the quagmire of a hung parliament and hope for the French electorate to deliver a more decisive result this time? Does Macron, at this point of self-inflicted chaos, have to consider his own resignation?",88,123,0.86,PoliticalDiscussion,Correct_Breadfruit46,https://www.reddit.com/r/PoliticalDiscussion/comments/1psktv9/how_can_france_deal_with_its_debt_crisis/,https://www.reddit.com/r/PoliticalDiscussion/comments/1psktv9/how_can_france_deal_with_its_debt_crisis/,"NEW DELHI, 07 March, 2026: India’s Joint Platform",India’s trade unions condemn US-Israeli aggression on Iran,southasiatimes_au,https://www.southasiatimes.com.au/south-asia/india/central-trade-unions/,2025-12-21 23:52:56
1pr5ige,"As political polarization between young men and women widens, is there evidence that this affects long-term partner formation, with downstream implications for marriage, fertility, or social cohesion?","Over the past decade, there is clear evidence that political attitudes among younger cohorts have become increasingly gender-divergent, and that this gap is larger than what was observed in previous generations at similar ages.

To ground this question in data:

* [A 2024 analysis from Brookings Institution summarizes polling showing that among 18–29 year olds, young women lean Democratic by margins exceeding 30 points, while young men are far closer to evenly split. The article notes that this represents a growing gender gap rather than a uniform youth shift.](https://www.brookings.edu/articles/the-growing-gender-gap-among-young-people/)
* [Gallup trend data shows that young women’s self-identified liberalism has increased substantially over time, rising from roughly the high-20 percent range in the early 2000s to around 40 percent in recent years, while young men’s ideological self-identification has shifted much less. This widening gap is larger among Gen Z than it was among Millennials at the same age.](https://news.gallup.com/poll/649826/exploring-young-women-leftward-expansion.aspx)
* [Survey data summarized by PRRI shows a similar pattern. Among Gen Z adults, 47 percent of women identify as liberal compared to 38 percent of men, indicating a persistent ideological gap within the same generation.](https://prri.org/research/generation-zs-views-on-generational-change-and-the-challenges-and-opportunities-ahead-a-political-and-cultural-glimpse-into-americas-future/)
* [Polling of young adults also suggests that politics may already be influencing how people think about relationships. The Spring 2025 Youth Poll from the Harvard Institute of Politics found that a majority of young women say political agreement is important in a romantic relationship, compared to a smaller share of young men.](https://iop.harvard.edu/youth-poll/50th-edition-spring-2025)

Taken together, these sources suggest that political identity among young adults is increasingly gender-divergent, and that this divergence forms relatively early rather than emerging only later in life.

*My question is whether there is evidence that this level of polarization affects long-term partner formation at an aggregate level, with downstream implications for marriage rates, fertility trends, or broader social cohesion.*

More specifically:

1. As political identity becomes more closely linked with education, reproductive views, and trust in institutions, does this reduce matching efficiency for long-term partnerships? If so, what are the ramifications to this?

2. Is political alignment increasingly functioning as a proxy for deeper value compatibility in ways that differ from earlier cohorts?

3. Are there historical or international examples where widening political divergence within a cohort corresponded with measurable changes in family formation or social stability?

I am not asking about individual dating preferences or making moral judgments about either gender. I am interested in whether structural political polarization introduces friction into long-term pairing outcomes, and how researchers distinguish this from other demographic forces such as education gaps, geographic sorting, or economic precarity.",264,403,0.94,PoliticalDiscussion,Raichu4u,https://www.reddit.com/r/PoliticalDiscussion/comments/1pr5ige/as_political_polarization_between_young_men_and/,https://www.reddit.com/r/PoliticalDiscussion/comments/1pr5ige/as_political_polarization_between_young_men_and/,Raisina Dialogue: S Jaishankar says India's rise is,India's rise is 'unstoppable' and it alone will determine trajectory of its growth: Jaishankar,deccanherald,https://www.deccanherald.com/india/indias-rise-is-unstoppable-and-it-alone-will-determine-trajectory-of-its-growth-jaishankar-3923235,2025-12-20 04:29:19
1pqsn0d,I’m a progressive and dating my conservative girlfriend (soon to be fiancée) has taught me how intolerant “progressives” are,"Disclaimer: I am as progressive as they come. You would have a hard time finding someone with my progressive credentials. Almost four years ago, I started dating my girlfriend. On paper, my girlfriend should be someone the left looks up to. She’s an immigrant (originally from Syria) and spends a lot of her free time promoting human/women’s rights in the Middle East. Right now, she’s currently kicking ass in dental school. There was just one problem: she’s a Trump-supporting conservative and proud of it.

She’s told me before that she gets more abuse for being a Trump supporter than for being an immigrant. To be honest, I wouldn’t have believed it, but I've been getting attacked for having the nerve to date someone who thinks differently from me. Most of my friends, both progressive and moderate (I don’t really have many conservative friends; I’m open, but the area I’m in is very progressive), supported our relationship. But the ones who didn’t and stopped being my friend were progressive. I was still in denial about how close-minded progressives were until I experienced nasty messages after posting on the advice sub because my girlfriend is conservative.

It’s been hard, I’m not going to lie. When you see that your so called allies and friends are apart of the problem


Edit: Sorry I can’t reply, my Karma isn’t high enough. I do want to highlight this comment, 

> Just by posting here you may be auto banned from several progressive subs.

>She's a woman. She's an immigrant. She is the best person to explain how is it possible that Trump is more aligned with her than progressives can be.

It’s sad to see. Progressives we love to talk about big gain about diversity and diversity is great. But what’s more important than diversity of skin color is diversity of thought.",1115,384,0.71,Conservative,NotSoFlyPie,https://www.reddit.com/r/Conservative/comments/1pqsn0d/im_a_progressive_and_dating_my_conservative/,https://www.reddit.com/r/Conservative/comments/1pqsn0d/im_a_progressive_and_dating_my_conservative/,Iran Says It Will Halt Attacks On Neighbours; Trump Calls,Iran Says It Will Halt Attacks On Neighbours; Trump Calls Them The 'Loser of Middle East',ndtv,https://www.ndtvprofit.com/world/iran-says-it-will-halt-attacks-on-neighbours-trump-views-it-a-surrender-11182213,2025-12-19 18:33:38
1ppffm3,Where was the declaration of war that Tucker and others were freaking out about,"All this unsubstantiated claims about us getting into a war and this attacks on Trump over being a lying warmonger for nothing. Tucker time and time again lies for money saying we would he into WW3 with Iran and now this, his credibility was already horrible and it is now somehow worse lmao. All this is is playing into dem propaganda and thy know it.

What are your guys thoughts",287,125,0.65,Conservative,Lordlolipops,https://www.reddit.com/r/Conservative/comments/1ppffm3/where_was_the_declaration_of_war_that_tucker_and/,https://www.reddit.com/r/Conservative/comments/1ppffm3/where_was_the_declaration_of_war_that_tucker_and/,Iran Says It Will Halt Attacks On Neighbours; Trump Calls,Iran Says It Will Halt Attacks On Neighbours; Trump Calls Them The 'Loser of Middle East',ndtv,https://www.ndtvprofit.com/world/iran-says-it-will-halt-attacks-on-neighbours-trump-views-it-a-surrender-11182213,2025-12-18 02:28:18
1ppc65h,"If Biden kept Trump's tariffs, will his Democratic successor keep the H‑1B fee too?","The [$100,000 H‑1B fee imposed](https://www.bloomberg.com/news/articles/2025-09-19/trump-to-add-new-100-000-fee-for-h-1b-visas-in-latest-crackdown) by President Trump in September 2025 may follow the same political trajectory as Trump's China tariffs—initially controversial, later normalized, and ultimately retained by a Democratic successor.

The previous tariff experience is revealing. Despite criticizing Trump's trade war during the 2020 campaign, President Biden [kept roughly $350 billion in tariffs](https://www.cnn.com/2022/01/26/politics/china-tariffs-biden-policy/index.html) on Chinese imports and later expanded them, raising [duties on electric vehicles, solar cells, and other strategic goods](https://www.npr.org/2024/05/10/1250670539/biden-china-tariffs-electric-vehicles). Tariffs proved ""painful but survivable"" for consumers and firms and became embedded in supply chains and agency practice. Once framed as tools to protect American workers and counter China, they became politically difficult to unwind.

A similar effect may now be emerging around the H‑1B fee. Although [twenty Democratic‑led states have sued](https://www.cnn.com/2025/12/12/politics/h-1b-visa-fee-lawsuit) to block the fee, an arguably more illuminating signal came from Congress. Shortly  after Trump's proclamation, Senators Dick Durbin and Chuck Grassley introduced the [bipartisan H‑1B and L‑1 Visa Reform Act of 2025](https://www.judiciary.senate.gov/press/rep/releases/grassley-durbin-propose-bipartisan-h-1b-and-l-1-visa-reforms-to-protect-american-workers-and-stop-outsourcing-jobs), reviving long‑standing concerns about wage depression and outsourcing. Durbin criticized Trump's method but [echoed the underlying critique](https://www.durbin.senate.gov/newsroom/press-releases/durbin-grassley-introduce-bipartisan-h-1b-l-1-visa-reform-bill) of corporate overuse of guest‑worker programs. [The bill's co‑sponsors span the populist left and right](https://www.klgates.com/Proposed-H1B-and-L1-Visa-Reform-Act-of-2025-10-21-2025), suggesting a durable cross‑ideological coalition skeptical of high‑skilled immigration as currently structured.

Meanwhile,, the administrative state is already building machinery to enforce the initiative. [Labor Secretary Lori Chavez‑DeRemer's ""Project Firewall"" ](https://economictimes.indiatimes.com/nri/latest-updates/abuse-h1b-and-face-consequences-us-labor-secretary-says-american-jobs-must-go-to-americans-first/articleshow/125943419.cms?from=mdr)altered the enforcement landscape by mandating that employers prove considered American workers via a searchable Department of Labor database before filing the H-1B petition. This is the type of regulatory hurdle that unions have historically favored. [Organized labor has argued that H‑1B rules suppress wages](https://www.dpeaflcio.org/factsheets/guest-worker-visas-the-h-1b-and-l-1); dismantling the fee and Firewall could be framed as abandoning domestic workers. For a future Democratic president—especially one courting Rust Belt states—repeal could look like a giveaway to Big Tech rather than a restoration of the prior status quo.

Because the fee was created by proclamation, a successor could eliminate it instantly. However ease of reversal does not guarantee that there is political will to do so.

**If Biden kept Trump's tariffs, will his successor keep the H‑1B fee too?**",0,16,0.28,PoliticalDiscussion,najumobi,https://www.reddit.com/r/PoliticalDiscussion/comments/1ppc65h/if_biden_kept_trumps_tariffs_will_his_democratic/,https://www.reddit.com/r/PoliticalDiscussion/comments/1ppc65h/if_biden_kept_trumps_tariffs_will_his_democratic/,Iran Says It Will Halt Attacks On Neighbours; Trump Calls,Iran Says It Will Halt Attacks On Neighbours; Trump Calls Them The 'Loser of Middle East',ndtv,https://www.ndtvprofit.com/world/iran-says-it-will-halt-attacks-on-neighbours-trump-views-it-a-surrender-11182213,2025-12-17 23:54:42
1po8o7h,"Chris Cilizza claims Mark Kelly has “Skeletons in his closet” claims that will prevent him from running for President in 2028, Has there been any discussion or rumors as to what those skeletons are?","Title says most of it. Chris Cilizza claims that when Mark Kelly was vetted for VP “skeletons in his closet” essentially took him out of the running and will prevent a 2028 presidential run. Chris did not elaborate on this though. Has there been any reporting on what these skeletons are? I know there was reporting that progressives didn’t like Kelly and he isn’t a strong pro-union candidate but I wouldn’t call those “skeletons”.

https://www.youtube.com/live/4jXH4CzfGEE?si=94vIFhCMAfrgoKAG
",109,178,0.8,PoliticalDiscussion,Galahad_Jones,https://www.reddit.com/r/PoliticalDiscussion/comments/1po8o7h/chris_cilizza_claims_mark_kelly_has_skeletons_in/,https://www.reddit.com/r/PoliticalDiscussion/comments/1po8o7h/chris_cilizza_claims_mark_kelly_has_skeletons_in/,Iran Says It Will Halt Attacks On Neighbours; Trump Calls,Iran Says It Will Halt Attacks On Neighbours; Trump Calls Them The 'Loser of Middle East',ndtv,https://www.ndtvprofit.com/world/iran-says-it-will-halt-attacks-on-neighbours-trump-views-it-a-surrender-11182213,2025-12-16 17:55:31
1pltugy,Trump says ‘we will retaliate’ after 3 Americans are killed in Syria attack that the U.S. blames on IS,,34,78,0.66,politics,Old_General_6741,https://www.reddit.com/r/politics/comments/1pltugy/trump_says_we_will_retaliate_after_3_americans/,https://www.ctvnews.ca/world/article/trump-says-we-will-retaliate-after-3-americans-are-killed-in-syria-attack-that-the-us-blames-on-is/,Iran Says It Will Halt Attacks On Neighbours; Trump Calls,Iran Says It Will Halt Attacks On Neighbours; Trump Calls Them The 'Loser of Middle East',ndtv,https://www.ndtvprofit.com/world/iran-says-it-will-halt-attacks-on-neighbours-trump-views-it-a-surrender-11182213,2025-12-13 19:31:35
1pkur8b,It don't think the country will ever reunite,"I have one of those liberal friends that is still willing to talk to me. And I asked her a question the other day, and her answer was pretty concerning and I think it's a similar answer to what a lot of liberals would say. 

She doesn't engage on the internet she's not the type to be a radical she doesn't trust most mainstream news networks but she definitely has been indoctrinated by enough of them to have severe TDS. So I try to avoid talking about Trump in general and I try to avoid emotional conversations like abortion or LGBT issues etc. 

So we were talking about crime, And she goes on her pre-rehearsed rant about how crime is because of poverty or drug use which is tied to poverty or mental health and that's why we need more rehabilitation and less prisons etc. So I made kind of a normal argument pretty standard to what most conservatives would I think. But I added another factor because one of the things that is becoming a more common problem is young teenagers ages 12 to 17 are being recruited because if they go commit a murder or other type of serious crime they get more leniency and reduced sentences. And I think just cracking down on gang violence would protect the next generation from these monsters. 

Anyway the question I asked was ""hypothetically if there was a scenario where we learned that irrefutably focusing on rehabilitation simply didn't work, would you eventually concede this world view and try it my way?"" She beat around the bush saying it might need tweaks to work and it would take time and blah blah blah. So I said, ""if you had a magic lamp and could implement all the policies you believe would help with this issue whether it be addressing income inequality or the housing crisis or whatever. And no matter what you tried nothing was reducing crime would you eventually try it my way?""

The short answer was no, And the reason this is so concerning to me is that these people care more about their worldview than they do about the victims and they aren't ever going to be willing to prioritize the victims unless they can also implement their worldview to do so. They simply can't acknowledge that they can be wrong about their ideas and to me that means they will simply get more desperate to make it work until they inevitably become radicals. It's anti-democracy at its core, The entire principle of democracy is that you're supposed to be able to vote for what you think will work and if it doesn't work you're supposed to be able to reconsider and vote for something else. The idea that they just can't possibly consider a different world view besides the blank slate theory is wild to me. 

I know that they can make the same argument about us of course and I would argue that I've changed my opinion of stance on multiple things based on new information. There's only a few world views that I would not reconsider but those are generally civil rights. I'm not going to suddenly have my mind changed on racial discrimination or removing the first Amendment. But as far as simple policies what's the point of continuing the same tactic regardless of results? And how can we possibly find common ground if they simply can't reconsider positions or open their mind to even hearing the other side? ",5,17,0.56,Conservative,fordr015,https://www.reddit.com/r/Conservative/comments/1pkur8b/it_dont_think_the_country_will_ever_reunite/,https://www.reddit.com/r/Conservative/comments/1pkur8b/it_dont_think_the_country_will_ever_reunite/,Iran Says It Will Halt Attacks On Neighbours; Trump Calls,Iran Says It Will Halt Attacks On Neighbours; Trump Calls Them The 'Loser of Middle East',ndtv,https://www.ndtvprofit.com/world/iran-says-it-will-halt-attacks-on-neighbours-trump-views-it-a-surrender-11182213,2025-12-12 15:29:48
